sujet,date,statut
Synthwave et imagerie rétro-futuriste spatiale en décoration,2025-10-12T16:11:57.416634,succès_2025-10-13_09:00
Guardians of the Galaxy : quand les couleurs cosmiques deviennent pop,2025-10-12T16:19:41.226944,échec_publication
Culture rave et nébuleuses fluorescentes dans la déco moderne,2025-10-12T16:23:17.575092,échec_publication
Interstellar et la nouvelle représentation des trous noirs,2025-10-12T16:27:12.139896,succès_2025-10-13_09:00
Science-fiction française et son influence sur l'art spatial européen,2025-10-12T16:32:04.935086,succès_2025-10-13_09:00
Mouvement Outrun : l'obsession pour les horizons cosmiques,2025-10-12T16:41:30.372107,succès_2025-10-13_09:00
Steampunk spatial : l'astronomie rétro réinventée en décoration,2025-10-12T16:48:53.656826,succès_2025-10-13_09:00
Influence de Moebius sur l'esthétique désertique-spatiale,2025-10-12T16:53:15.460124,échec_publication
Cosmic Horror : de Lovecraft aux intérieurs gothiques spatiaux,2025-10-12T16:57:11.553343,échec_publication
Mythologies stellaires africaines dans l'art contemporain,2025-10-12T17:00:29.733276,échec_publication
Science-fiction française et son influence sur l'art spatial européen,2025-10-12T17:38:22.666723,succès
Mouvement Outrun : l'obsession pour les horizons cosmiques,2025-10-13T06:58:49.863457,succès
Steampunk spatial : l'astronomie rétro réinventée en décoration,2025-10-13T07:04:34.644217,succès
Influence de Moebius sur l'esthétique désertique-spatiale,2025-10-13T07:09:10.602359,succès
Comment choisir une palette de couleurs neutres pour un Airbnb ?,2025-10-13T07:48:48.775953,succès
Quelles sont les meilleures idées de décoration minimaliste pour location saisonnière ?,2025-10-13T07:53:18.247636,succès
Comment choisir un tableau à offrir en cadeau sans connaître les goûts exacts ?,2025-10-20T11:26:07.761255,succès
Les tableaux abstraits sont-ils des cadeaux sûrs pour tous les profils ?,2025-10-23T05:33:25.940478,succès
Comment emballer élégamment un tableau pour l'offrir en cadeau ?,2025-10-27T05:34:10.953172,succès
Faut-il privilégier un tableau encadré ou laisser le choix du cadre ?,2025-10-30T05:32:16.874776,succès
Comment personnaliser un tableau cadeau sans le dénaturer ?,2025-11-03T05:33:45.822889,succès
Les tableaux avec message inspirant sont-ils appréciés en cadeau ?,2025-11-06T05:33:13.530924,succès
Quel type de tableau offrir pour un mariage ?,2025-11-10T05:32:48.535752,succès
Comment déterminer le style de tableau qui plaira au destinataire ?,2025-11-13T05:33:15.344238,succès
Faut-il offrir un tableau original ou une reproduction de qualité ?,2025-11-17T05:35:15.344669,succès
Quels tableaux conviennent comme cadeau de pendaison de crémaillère ?,2025-11-20T05:34:03.095058,succès
Comment choisir un tableau à offrir à un couple ?,2025-11-24T05:33:05.863509,succès
Les tableaux personnalisés avec prénoms sont-ils trop intrusifs ?,2025-11-27T05:33:18.089108,succès
Comment accompagner un tableau cadeau d'un message touchant ?,2025-12-01T05:33:10.887983,succès
Faut-il privilégier les tableaux neutres ou audacieux en cadeau ?,2025-12-04T05:33:02.067648,succès
Quels tableaux offrir pour une naissance ou un baptême ?,2025-12-08T05:32:45.684307,succès
Comment choisir un tableau cadeau adapté à différents âges ?,2025-12-11T05:33:05.495837,succès
Les tableaux de paysages sont-ils des valeurs sûres en cadeau ?,2025-12-15T05:35:29.888421,succès
Comment vérifier discrètement les préférences déco avant d'offrir un tableau ?,2025-12-18T05:33:08.330524,succès
Faut-il offrir un tableau avec certificat d'authenticité ?,2025-12-22T05:33:58.100535,succès
